{
  "job_id": "rl300_render_ready_blend",
  "package_model": "RL300_SAFE",
  "cad_source": {
    "file_path": "C:/Projects/CAD/RL300-SAFE/RL300-SAFE-render_ready.blend",
    "format": "blend",
    "up_axis": "Z",
    "unit_scale": 1.0
  },
  "camera": {
    "preset": "P1_FRONT_ISO",
    "focal_length_mm": 50.0,
    "elevation_deg": 14.0,
    "azimuth_deg": 45.0,
    "target_offset": [0.0, 0.0, 0.80],
    "distance_multiplier": 3.85
  },
  "geometry": {
    "smooth_hardware": true,
    "hide_misplaced_isolators": true
  },
  "livery": {
    "preset": "preserve_existing"
  },
  "lighting": {
    "preset": "preserve_existing",
    "intensity_multiplier": 1.0,
    "shadow_catcher": true
  },
  "output": {
    "width": 1920,
    "height": 1080,
    "samples": 128,
    "engine": "CYCLES",
    "denoiser": "OPENIMAGEDENOISE",
    "passes": {
      "beauty": true,
      "alpha_mask": true,
      "depth_map": true,
      "surface_normals": false,
      "contact_shadow": true
    },
    "output_dir": "./output/rl300_render_ready"
  },
  "compositing": {
    "enabled": false
  }
}
