{
  "job_id": "rl300_04_studio-white",
  "package_model": "RL300_SAFE",
  "_description": "White soft studio for appearance review against the standing RL200 photograph. Same CAD, camera and materials as the accepted v6 dark reference. The visible backdrop is the neutral white sweep; the lighting environment is a separate equirectangular studio map so bare metal has softboxes and a dark side to reflect. This is an independent visual reference, not a replacement for the accepted dark T04 anchor.",
  "cad_source": {
    "file_path": "cad/RL300-SAFE-photoreal.blend",
    "format": "blend",
    "up_axis": "Z",
    "unit_scale": 1.0
  },
  "camera": {
    "preset": "CUSTOM",
    "focal_length_mm": 85.0,
    "elevation_deg": 11.0,
    "azimuth_deg": 42.0,
    "distance_multiplier": 6.6,
    "target_offset": [
      0.0,
      0.0,
      0.92
    ],
    "depth_of_field": {
      "enabled": true,
      "f_stop": 11.0,
      "blades": 8
    }
  },
  "geometry": {
    "smooth_hardware": false,
    "hide_misplaced_isolators": true
  },
  "livery": {
    "preset": "preserve_existing"
  },
  "lighting": {
    "preset": "studio_white",
    "intensity_multiplier": 0.7,
    "analytic_lights": true,
    "shadow_catcher": true,
    "hdri_path": "backgrounds/env_studio-softbox.png",
    "hdri_strength": 2.0,
    "hdri_rotation_deg": 0.0
  },
  "photoreal": {
    "enabled": true,
    "bevel": {
      "enabled": true,
      "radius_m": 0.0004,
      "samples": 4
    },
    "quality": {
      "max_bounces": 8,
      "diffuse_bounces": 3,
      "glossy_bounces": 6,
      "transmission_bounces": 6,
      "transparent_bounces": 8,
      "clamp_indirect": 10.0,
      "blur_glossy": 1.0,
      "light_tree": true,
      "adaptive_sampling": true,
      "adaptive_threshold": 0.02,
      "caustics_reflective": false,
      "caustics_refractive": false
    },
    "powder_coat": {
      "enabled": true,
      "materials": [
        "MSP_YELLOW_PAINT"
      ],
      "coat_weight": 0.85,
      "coat_roughness": 0.05,
      "roughness_min": 0.34,
      "roughness_max": 0.52,
      "roughness_noise_scale": 45.0,
      "peel_scale": 650.0,
      "peel_strength": 0.3,
      "peel_distance": 0.0012,
      "bevel_radius_m": 0.001,
      "flow_scale": 130.0,
      "flow_weight": 0.6
    },
    "metal_finish": {
      "enabled": true,
      "materials": {
        "MSP_ALUMINUM_CAST": {
          "base_color": [
            0.79,
            0.795,
            0.8
          ],
          "metallic": 1.0,
          "roughness_machined": 0.22,
          "roughness_cast": 0.32,
          "cast_scale": 25.0,
          "grain_scale": 1400.0,
          "grain_strength": 0.06,
          "grain_distance": 0.00012
        },
        "MSP_ALUMINUM_CAST_TURNED": {
          "base_color": [
            0.79,
            0.795,
            0.8
          ],
          "metallic": 1.0,
          "roughness_machined": 0.22,
          "roughness_cast": 0.32,
          "cast_scale": 25.0,
          "grain_scale": 1400.0,
          "grain_strength": 0.06,
          "grain_distance": 0.00012,
          "anisotropy": 0.4,
          "anisotropy_axis": "Y",
          "_why_axis": "The barrel is turned on a lathe about its own axis, so the highlight stretches around it. ShaderNodeTangent in radial mode takes an OBJECT-space axis: edit_rl300_geometry.py bakes the fitting's orientation so its axis of revolution is local Y. Scoped to this cloned material because the four objects on MSP_ALUMINUM_CAST disagree - V251415K55_Aluminum Cam and Groove Hose Coupling-1 revolves about local X, and one shared axis would streak it across the barrel instead of around it."
        },
        "MSP_STAINLESS_FASTENER": {
          "base_color": [
            0.86,
            0.865,
            0.87
          ],
          "metallic": 1.0
        },
        "MSP_STAINLESS": {
          "base_color": [
            0.82,
            0.83,
            0.84
          ],
          "metallic": 1.0
        }
      },
      "reassign": [
        {
          "match": "00023779",
          "material": "MSP_STAINLESS"
        },
        {
          "match": "^V2HWR-(BLT|WSH)",
          "material": "MSP_STAINLESS_FASTENER"
        },
        {
          "match": "^PUMP_END_CASTSTEEL-1$",
          "material": "MSP_BLACK_CHASSIS",
          "_why": "The Vogelsang pump end arrives as one fused solid carrying eight auto-named glTF colour materials, 95% of its faces on flat white. It is cast steel painted black, so every slot goes to the painted black chassis material rather than shading as white plastic."
        },
        {
          "match": "SAE Washer",
          "material": "MSP_STAINLESS_FASTENER",
          "_why": "V296659A111_.625in_18-8 Stainless Steel SAE Washer-1/-2 arrive on MSP_YELLOW_PAINT from the CAD, so two stainless washers shade as powder coat. Matched on the short form because the part number contains regex metacharacters."
        }
      ]
    }
  },
  "output": {
    "width": 1800,
    "height": 1250,
    "samples": 96,
    "engine": "CYCLES",
    "denoiser": "OPENIMAGEDENOISE",
    "color": {
      "view_transform": "AgX",
      "look": "AgX - Medium High Contrast",
      "exposure": -1.5,
      "gamma": 1.0
    },
    "passes": {
      "beauty": true,
      "alpha_mask": true,
      "depth_map": true,
      "surface_normals": false,
      "contact_shadow": false
    },
    "output_dir": "./output/rl300_04_studio-white"
  },
  "compositing": {
    "enabled": true,
    "background_plate": "backgrounds/env_studio-white.png",
    "shadow_opacity": 0.0,
    "sun_direction": "top_left",
    "product_scale": 1.0,
    "product_offset_px": [
      0,
      0
    ],
    "product_offset_pct": [
      0.0,
      -0.02
    ]
  }
}
